{"$schema":"https://json-schema.org/draft/2020-12/schema","type":"object","required":["schema_version","status","fixture","gate","rows","runtime","lifecycle_guards","provenance"],"properties":{"schema_version":{"const":"synthetic-fast-route-vjp-validation-v2"},"status":{"enum":["SYNTHETIC_FAST_ROUTE_VJP_VALIDATION_PASS","SYNTHETIC_FAST_ROUTE_VJP_VALIDATION_FAIL_CLOSED"]},"fixture":{"type":"object"},"gate":{"type":"object"},"rows":{"type":"array","maxItems":5},"failure_reason":{"type":"string"},"runtime":{"type":"object","required":["validation_execution_attempted"],"properties":{"validation_execution_attempted":{"const":true}}},"lifecycle_guards":{"type":"object"},"provenance":{"type":"object"}},"allOf":[{"if":{"properties":{"status":{"const":"SYNTHETIC_FAST_ROUTE_VJP_VALIDATION_PASS"}}},"then":{"properties":{"rows":{"minItems":5}}}}],"additionalProperties":false}
