{
  "failure_reason": "SyntheticValidationFailClosed: synthetic route changed during directional preflight",
  "fixture": {},
  "gate": {},
  "lifecycle_guards": {
    "baseline_selection_performed": false,
    "final_test_accessed": false,
    "optimized_mb_grid_performed": false,
    "publication_training_performed": false,
    "security_functional_changed": false,
    "synthetic_fast_validation_executed": false,
    "threshold_approved": false
  },
  "provenance": {
    "execution_manifest_sha256": "a5c677d138de8da98b3e67ce4973044485aaa6ac31f7f2938a25b2df962edc22"
  },
  "rows": [],
  "runtime": {
    "validation_execution_attempted": true
  },
  "schema_version": "synthetic-fast-route-vjp-validation-v2",
  "status": "SYNTHETIC_FAST_ROUTE_VJP_VALIDATION_FAIL_CLOSED"
}
